question,answer
__solid mass of cell fragments and other substances that plugs a leak in a blood vessel,blood clot
__condition in which blood does not have enough hemoglobin (or iron) to carry adequate oxygen to,anemia
__type of cancer in which bone marrow produces abnormal white blood cells,leukemia
__genetic disorder in which abnormal hemoglobin causes red blood cells to change shape,sickle-cell disease
The cardiovascular system normally contains about 2.5 liters of blood.,false
Antigens on your red blood cells determine your blood type.,true
"__small, sticky cell fragment that helps blood clot",platelet
Dissolved substances in blood include red and white blood cells.,false
__classification of an individuals blood based on its red blood cell antigens,blood type
__genetic disorder in which blood is lacking a normal clotting factor,hemophilia
One cause of anemia is excessive loss of blood due to injury or surgery.,true
Blood in veins carries oxygen and nutrients to all the cells of the body.,false
How much blood does your cardiovascular system normally contain?,4.55.0 liters
How does blood carry oxygen molecules?,Iron in hemoglobin binds with them.
Which genotype produces blood type A?,AO
The blood of a person with leukemia cannot,fight infections.
A person with sickle-cell hemoglobin is resistant to,malaria.
"When you inhale, air passes from your pharynx to your",larynx.
"When you exhale, why does carbon dioxide diffuse from the blood into the air in the lungs?",Carbon dioxide is more concentrated in the blood than in the air.
Inhaling occurs when the,size of the chest increases.
Gas exchange occurs twice during the process of respiration.,true
Air is inhaled when the diaphragm relaxes.,false
Cilia in the bronchi sweep mucus and particles toward the alveoli.,false
Each alveolus is surrounded by a network of capillaries.,true
The lungs are the main organs of the respiratory system.,true
"When the diaphragm contracts, air flows out of the lungs.",false
"When you inhale, oxygen is more concentrated in the blood than in the air inside alveoli.",false
Pneumonia may be caused by an infection or an injury to the lungs.,true
"When you exhale, carbon dioxide diffuses out of the blood into the air in the alveoli.",true
"In some people, asthma attacks may be triggered by strenuous exercise.",true
Particles in air are trapped by hairs in the nose and cilia in the bronchi.,true
"During an asthma attack, the bronchioles widen and produce less mucus.",false
__tiny air sac in the lungs where gas exchange takes place,alveolus
"__large, sheet-like muscle below the lungs needed for normal breathing",diaphragm
__voice box,larynx
__process of moving air into and out of the lungs,breathing
__process in which cells obtain energy by burning glucose,cellular respiration
__one of two passages that carry air between the trachea and bronchioles,bronchus
__wind pipe,trachea
"When you inhale through your nose, which organ does the air pass through next?",pharynx
What happens when the diaphragm contracts?,Air rushes into the lungs.
Why does oxygen pass into cells from the blood of capillaries?,Oxygen diffuses down a concentration gradient from the blood to cells.
The main symptom of emphysema is,shortness of breath.
Bronchioles connect the,bronchi and alveoli.
The lungs are part of the respiratory system and the,excretory system.
Organs of excretion include the large intestine and sweat glands in the skin.,true
Blood containing wastes enters each kidney through a ureter.,false
The part of a nephron that filters blood is the,glomerulus.
Blood containing wastes enters the kidneys through,arteries.
All of the water filtered out of the blood in the kidneys is excreted in urine.,false
The process of urination is normally under conscious control.,true
Hormones secreted by the kidneys help regulate,blood pressure.
The kidneys filter all of the blood in the body once a day.,false
What does a hemodialysis machine do?,It filters wastes out of the blood.
One function of the kidneys is to help keep blood pressure within a normal range.,true
"You need both kidneys to live a normal, healthy life.",false
The urinary system includes all of the following organs except the,liver.
How many nephrons does each kidney contain?,"more than 1,000,000"
Clean blood leaves a kidney through a(n),vein.
The liver removes excess water and salts from the blood.,false
Each kidney contains more than a million nephrons.,true
Urine moves through the ureters by,peristalsis.
Some of the water filtered out of the blood by nephrons is reabsorbed.,true
How do the kidneys help maintain homeostasis?,They control the amount of water in the body.
How does untreated diabetes cause kidney failure?,It damages capillaries in the kidneys.
The bladder is the urinary system organ where urine forms.,false
The only cure for kidney failure is a kidney transplant.,true
__muscular tube that carries urine out of the body,urethra
__tiny structure in a kidney that filters blood and forms urine,nephron
__sac-like organ that stores urine,urinary bladder
__mineral crystal that forms in urine inside a kidney,kidney stone
__artificial filtering of blood through a machine,hemodialysis
__muscular tube that carries urine from a kidney to the urinary bladder,ureter
__main organ of the urinary system,kidney
_________smallest particle of an element that still has the properties of that element,atom
_________carbohydrate that makes up the cell walls of plants,cellulose
_________biochemical compound that consists of nucleotides,nucleic acid
_________smallest particle of a compound that still has the properties of that compound,molecule
_________class of biochemical compound that consists of amino acids,protein
_________class of biochemical compound that consists of fatty acids,lipid
_________protein that speeds up biochemical reactions,enzyme
_________Atoms can be observed only with an electron microscope.,true
_________Glycogen is a complex carbohydrate found in animals.,true
_________Glucose is a polymer of starch.,false
_________Saturated fatty acids are found in oils,false
_________The genetic code tells cells how to make proteins.,true
_________The substances that start a chemical reaction are called products.,false
_________Cellular respiration involves catabolic reactions.,true
Major elements in the human body include,hydrogen.
Which of the following is one of the four main classes of biochemical compounds?,carbohydrates
Uses of lipids include,storing energy.
How does RNA differ from DNA?,RNA consists of one chain of nucleotides rather than two chains.
Anabolic reactions are biochemical reactions in which,chemical bonds are formed.
Which statement about enzymes is true?,Enzymes speed up biochemical reactions.
A bundle of nerve cells make up a(n),nerve.
How do nerve impulses travel across a synapse?,They are carried across by special chemicals.
The type of neuron that carries messages from the brain to internal organs and glands is a(n),motor neuron.
Which statement about the brain is false?,It is the largest organ in the body.
Which part of the brain controls involuntary functions such as heartbeat?,brain stem
The part of the cerebrum that controls hearing is the,temporal lobe.
Which part of the peripheral nervous system controls only involuntary responses of the body?,autonomic nervous system
Which part of the peripheral nervous system controls muscles that are under voluntary control?,somatic nervous system
Use of a drug without the advice of medical professionals and for reasons not originally intended is referred to as,drug abuse.
A stroke occurs when a blood clot blocks blood flow to part of the brain.,true
Psychoactive drugs include antidepressants and caffeine.,true
The cerebellum is divided down the middle to form right and left hemispheres.,false
The spinal cord is part of the peripheral nervous system.,false
The sensory division of the peripheral nervous system carries messages away from the brain.,false
A single neuron may have thousands of dendrites.,true
The cerebellum controls conscious functions such as thinking and speaking.,false
The two hemispheres of the cerebrum are identical to each other.,false
The peripheral nervous system includes all of the nervous tissue in the body except for the brain.,false
The sympathetic division of the autonomic nervous system prepares the body for emergencies.,true
Seizures in epilepsy are caused by abnormal electrical activity in the brain.,true
All psychoactive drugs are illegal drugs.,false
__type of nerve cell that carries nerve impulses back and forth between sensory and motor neurons,interneuron
__largest part of the brain,cerebrum
__part of a neuron that contains the nucleus and other organelles,cell body
__part of the brain that controls coordination and balance,cerebellum
__part of a neuron that receives nerve impulses from other cells,dendrite
__part of a neuron that passes on nerve impulses to other cells,axon
__electrical message carried by neurons,nerve impulse
We see most objects because they reflect light from another source.,true
The colored part of the eye is called the iris.,true
Which statement about hyperopia is true?,It can be corrected with convex lenses.
Nerve impulses travel from the ears to the brain through the,auditory nerve.
Hyperopia can be corrected with concave lenses.,false
The only function of the ears is to sense sound.,false
How many different tastes can taste buds detect?,5
Taste neurons on the tongue can detect thousands of different tastes.,false
What happens when sound waves strike the eardrum?,It vibrates.
Sensory neurons in the nose sense chemicals in the air.,true
The sense of smell plays an important role in the sense of taste.,true
__structure in the inner ear that responds to vibrations by sending nerve impulses to the auditory nerve,cochlea
__opening in the center of the eye that lets light pass through,pupil
__vision problem in which distant objects can be seen clearly but nearby objects appear blurry,hyperopia
__layer of cells at the back of the eye where images normally form,retina
"If you lost vision in one eye, you could still see in three dimensions.",false
"When light reaches the eye, it passes first through the iris.",false
__vision problem in which nearby objects can be seen clearly but distant objects appear blurry,myopia
The middle ear contains the cochlea and semicircular canals.,false
__structure in the inner ear involved in maintaining balance,semicircular canal
__bundle of sensory neurons on the tongue that sense chemicals in food,taste bud
Nerve cells that sense touch are most numerous in the skin.,true
Rods are light-sensing cells in the eye that can sense dim light.,true
"When light from an object reaches the human eye, it passes first through the",cornea.
Which statement about rods and cones in the human eye is false?,Rods and cones are special light-sensing cells in the lens.
Myopia,occurs when images focus in front of the retin
The human eye senses differences in the wavelengths of visible light as different,colors.
Nerve cells that sense touch are found mainly in the,skin.
All endocrine glands secrete hormones into,the bloodstream.
__messenger molecule released by an endocrine gland,hormone
__pancreatic hormone that helps cells absorb glucose from the blood,insulin
Which endocrine gland secretes luteinizing hormone?,pituitary gland
__any gland that secretes hormones into the bloodstream,endocrine gland
__gland that secretes sex hormones,gonad
The hormone called ACTH,is secreted by pituitary gland.
__part of the brain that secretes hormones affecting the pituitary gland,hypothalamus
Which statement about gigantism is true?,It is characterized by excessive growth during childhood.
__pituitary hormone that stimulates the mammary glands to produce milk,prolactin
__master gland of the endocrine system,pituitary gland
Which structure provides a link between the nervous and endocrine systems?,hypothalamus
Most pituitary hormones control,other endocrine glands.
The pituitary hormone called follicle-stimulating hormone stimulates the,testes to produce sperm.
Which gland secretes growth hormone?,pituitary gland
Follicle-stimulating hormone is secreted by the gonads.,false
The thymus gland is part of the endocrine system.,true
Endocrine hormones influence target cells by,binding with proteins on the surface of the cells.
The output of most endocrine hormones is controlled by positive feedback loops.,false
Males and females have the same endocrine glands except for the,gonads.
What happens when the level of thyroxin rises in the blood?,The level of TSH in the blood falls.
Type 1 diabetes occurs when the immune system attacks cells of the adrenal glands.,false
The hormone adrenaline prepares the body for emergencies.,true
Endocrine hormones travel more slowly than nerve impulses.,true
Endocrine hormones affect only nearby cells.,false
The pineal gland is part of the endocrine system.,true
All hormones released by the hypothalamus control the pituitary gland.,false
The pituitary gland is located in the neck.,false
Growth hormone stimulates cells to make proteins.,true
Luteinizing hormone is secreted by the gonads.,false
The common cold is,an infectious disease.
Diseases caused by bacteria include,syphilis.
Diseases that can spread by airborne droplets include,influenza.
Which disease can potentially be cured with antibiotic drugs?,tuberculosis
Which type of pathogen causes AIDS?,virus
The vector that spreads malaria is a,mosquito.
An example of a pathogen that spreads through water is,Giardia lamblia.
All of the following diseases can be prevented with vaccines except,the common col
Which human infectious disease can be prevented with a vaccine?,genital warts
Schistosoma is a human parasite that is spread by a vector..,false
An example of a bacterium that may cause human disease is Escherichia coli.,true
Human viral infections include tetanus and measles.,false
A common human fungal infection is genital herpes.,false
"When you cough or sneeze, you should cover your mouth and nose with your hand.",false
The best way to prevent diseases spread by vectors to is avoid contact with the vectors.,true
Travelers diarrhea is generally caused by protozoa.,true
Infectious diseases are contagious because they are caused by pathogens.,true
You can pick up the virus that causes the common cold from an object such as a doorknob.,true
The proper way to wash your hands is to scrub with soap for at least 20 seconds.,true
A disease that can potentially be cured with antibiotics is strep throat.,true
Athletes foot is a common infectious disease caused by protozoa.,false
__any organism that carries pathogens from one organism to another,vector
__any disease that is caused by pathogens,infectious disease
__type of drug that is used to cure bacterial diseases,antibiotic
__substance that is used to prevent certain infectious diseases,vaccine
__type of organisms that cause malaria and giardiasis,protozoa
__any organism or virus that causes disease in another living thing,pathogen
__particle that reproduces by taking over living cells,virus
Cancer in childhood is rare.,true
Warning signs of cancer include difficulty swallowing.,true
Surgery is the only way to treat cancer.,false
Type 1 diabetes usually develops in childhood or adolescence.,true
Your risk of developing type 2 diabetes is greater if you are overweight.,true
"In multiple sclerosis, the immune system attacks the joints.",false
Hay fever is a noninfectious disease characterized by a high fever.,false
__mass of abnormal tissue formed by cancer cells,tumor
__any disease that is not contagious,noninfectious disease
__disease in which the level of glucose in the blood is too high,diabetes
__anything in the environment that may cause cancer,carcinogen
__any substance that may cause an allergy,allergen
__disease in which cells divide out of control,cancer
__any disease caused by the immune system attacking the bodys own cells,autoimmune disease
Mutations that lead to cancer usually occur in genes that control the,cell cycle.
The most common type of cancer in adult males is cancer of the,prostate glan
The second-most-common type of cancer in adult males and females is cancer of the,lung.
All of the following are autoimmune diseases except,type 2 diabetes.
Allergies are,commonly caused by pollen.
All of the following are needed for reproduction in males except the,ureters.
__tube that carries sperm from the epididymis to the urethra,vas deferens
__major male sex hormone,testosterone
Which of the following structures is part of two different organ systems in males?,urethra
Which statement about sperm is false?,Maturation of sperm takes place in the vas deferens.
__whitish fluid that contains sperm,semen
__male sex cell,sperm
The nucleus of a human sperm cell,contains 23 chromosomes.
__coiled tube where sperm mature,epididymis
A spermatid is a(n),immature sperm cell.
__male organ that contains the urethra,penis
__structure that secretes a fluid that helps form semen,prostate gland
Sperm mix with secretions as they pass through the vas deferens.,true
An adult male normally produces about 100 sperm each day.,false
Testosterone is needed for the production of sperm.,true
Sperm are the smallest of all human cells.,true
Sperm swim at a speed of about 3 inches per hour.,false
Which of the following statements about sperm is false?,Sperm are diploid cells.
How many sperm does the average adult male produce each day?,millions
Sperm cells leave the body through the,urethra.
The acrosome of a sperm,contains enzymes.
"For sperm to form and mature, it takes up to two",months.
The reproductive system is the only human body system that differs significantly between males and,true
Both mitosis and meiosis are involved in the production of sperm.,true
Testosterone causes the voice to deepen when a male goes through puberty.,true
The only external male reproductive organ is the penis.,false
Testosterone is a hormone secreted by the prostate gland.,false
Sperm are stored in the vas deferens until they leave the body.,false
A teaspoon of semen may contain as many as half a billion sperm.,true
Fertilization of an egg normally takes place while the egg is in the,fallopian tube.
__structure where fertilization of an egg normally occurs,fallopian tube
__cylinder-shaped organ through which a baby passes during birth,vagina
Which statement about human eggs is false?,There are billions of eggs in each ovary at birth.
Which statement about the human uterus is false?,"It has just one opening, called the cervix."
__one of a pair of organs that produce and release eggs,ovary
__organ where a fetus develops and grows until birth,uterus
Which of the following organs opens directly to the surface of the body?,vagina
__female gamete,egg
The structure in which an egg develops inside an ovary is called a,follicle.
__small opening that connects the uterus to the vagina,cervix
__main female sex hormone,estrogen
Estrogen causes the changes of puberty in females.,true
"Following puberty, an egg is released by each ovary about once a week.",false
Estrogen is secreted by female gonads.,true
"To fertilize an egg, sperm must swim from the vagina to an ovary.",false
The menstrual cycle is also called a menstrual period.,false
The main female reproductive organs are inside the body.,true
The male and female reproductive systems have identical functions.,false
Estrogen is needed for an adult woman to release eggs from the ovaries.,true
The ovaries make eggs only after a female has gone through puberty.,false
The upper end of each fallopian tube is attached to an ovary.,false
An egg completes meiosis just before it leaves the ovary.,false
"While an egg is developing in a follicle, the lining of the uterus breaks down and passes out of the",false
"When a girl is born, how many eggs does each of her ovaries normally contain?",thousands
Which female reproductive structure secretes estrogen?,ovary
An egg reaches the uterus through,a fallopian tube.
"For fertilization to take place, sperm generally must be deposited in the",vagina.
A human egg cell,lacks a tail.
The layer of a blastocyst that develops into the placenta is the,trophoblast.
"After fertilization occurs, how long does it normally take for the blastocyst to reach the uterus and implant in the uterine lining?",about a week
"By the end of the embryonic stage, the embryo is about",1 inch long.
During which stage of development do most organs start to form?,embryo
Which of these events occurs during the embryonic stage?,The heart begins to beat.
Which of the following changes does not occur during the fetal stage?,The blood starts to circulate.
About how much does a 38-week fetus weigh?,610 pounds
At about how many weeks after fertilization does birth typically occur?,38
"During infancy, which of these developments generally occurs first ?",smiling
During which of the following life stages is growth in height and weight usually most rapid?,infancy
A babys first teeth start coming in at about 12 months of age.,false
Toddlers grow more rapidly than infants.,false
Puberty occurs at the same age in all children.,false
A boys voice deepens at puberty as his larynx grows bigger.,true
People generally start showing signs of aging in middle adulthood.,true
A zygote has the haploid number of chromosomes.,false
"As soon as a zygote starts to divide, it is called an embryo.",false
Most organs start to form during the embryonic stage.,true
The fetal period typically lasts about 30 weeks.,true
The purpose of the placenta is to cushion the fetus and protect it from injury.,false
The umbilical cord is cut only after the baby starts to breathe on its own.,false
Puberty generally occurs at an earlier age in girls than in boys.,true
__process in which a blastocyst embeds in the uterine lining,implantation
__fluid-filled membrane that surrounds and protects a fetus,amniotic sac
__fluid-filled ball of cells that forms soon after fertilization occurs,blastocyst
__cell layer in the blastocyst that will develop into the placenta,trophoblast
__tube containing blood vessels that connects a fetus to the placenta,umbilical cord
__cell that results when a sperm fertilizes an egg,zygote
__temporary organ consisting of blood vessels from both the mother and fetus,placenta
Which STI cannot be cured with antibiotics?,genital herpes
__serious condition that may occur if tampons are not changed often,toxic shock syndrome
__any sexually transmitted infection,STI
Most females should start regular breast cancer screening at about age,40 years.
Which age group has the greatest risk of cancer of the testes?,between ages 15 and 35 years
__virus that causes genital warts,HPV
__virus that may cause AIDS,HIV
__viral STI that can be prevented with a vaccine,genital warts
Which STI can be prevented with a vaccine?,genital warts
__disease that may develop in someone infected with HIV,AIDS
__most common bacterial STI in the U.S.,chlamydia
An STI is any medical problem that affects the reproductive organs.,false
STIs always cause symptoms.,false
STIs are most common in teens and young adults.,true
HIV destroys lymphocytes that normally fight infections.,true
It is normal to have abdominal cramps during menstruation.,true
Many STIs can spread through body fluids such as blood.,true
A person with just one sexual partner cannot get STIs by sexual contact.,false
Untreated STIs may lead to the inability to have children.,true
Viral STIs usually last for life.,true
AIDS is diagnosed in anyone who has an HIV infection.,false
Injuries to the testes are very rare.,false
Ovarian cysts are usually harmless.,true
In which of the following age groups are STIs most common?,teens and young adults
What causes STIs?,pathogens
Which STI can be treated with antibiotics?,syphilis
The most common reproductive system cancer in young males is cancer of the,testes.
Infection with HPV may eventually lead to,cancer.
Which statement about STIs is false?,All STIs can be cured with antibiotics.
All organisms have the same basic needs.,true
Environmental factors can be classified as either biotic or abiotic.,true
An individual is a single living thing.,true
Members of the same population rarely interact with each other.,false
The biotic component of a biome is a community.,false
An ecosystem includes only biotic factors.,false
The biosphere includes all the other levels of organization in ecology.,true
__individual living thing,organism
__any living or once-living aspect of the environment,biotic factor
__group of similar ecosystems,biome
__group of individuals of the same species that live in the same area,population
__any aspect of the environment that has never been alive,abiotic factor
__all the biotic and abiotic factors in an area and their interactions,ecosystem
__all the populations of all the species that live in the same area,community
Biotic factors in the environment include,remains of dead organisms.
Ecosystems in a biome have the same general,abiotic factors.
Which choice shows levels of organization in ecology from smaller to larger?,ecosystem ! biome ! biosphere
Abiotic factors in the environment include all of the following except,organic wastes.
The total human population reached 7 billion people by the year,2014.
The demographic transition is a model based on what actually occurred in,Western Europe and North America.
The human species evolved in Africa. Human beings first left Africa about,"40,000 years ago."
"At its current rate of growth, the human population will surpass 9 billion by the year",2050.
The most common pattern of population distribution is a random pattern.,false
Only births and deaths change the size of a population.,false
A pattern of exponential population growth generally cannot continue for very long.,true
The age-sex structure of a population may influence the populations growth rate.,true
The size and growth rate of its populations influences the chances of a species surviving.,true
