question,answer
"if a miner is standing on a fault, the __________ wall is where his safety helmet would be and the __________ wall is where his steel toed boots would be.",hanging; foot
"if there is no movement on either side of a fracture, the fracture is called this.",a joint
mountain ranges can uplift on these types of faults.,normal faults
if the angle of a fault is inclined relative to the horizontal it is a,dip-slip fault
horizontal-appearing layers can have a younger rock below an older rock if they are separated by a thrust fault.,true
why wont california west of the san andreas fault fall into the pacific ocean?,the motion along the fault is horizontal.
strike slip faults result from __________ stresses.,shear
this type of reverse fault has a plane angle that is nearly horizontal.,thrust fault
"at the san andreas fault, the pacific plate is moving north relative to the north american plate. this means that the san andreas is a",right-lateral strike-slip fault.
"in a normal fault, the hanging wall goes up and the footwall goes down.",false
a levee that protects the land near a river from flooding,may cause there to be flooding upstream or downstream.
a raised structure designed to hold back the waters of a stream or river in case of a flood.,dam
this river flooded sometimes causes extreme floods in the midwestern u.s.,the mississippi river
flooding is often worse when vegetation is cleared.,true
"floods are relatively recent phenomenon, only occurring since humans have altered the landscape.",false
the lands downstream from a dam are safe from flooding.,false
plants reduce flooding by,slowing the raindrops down so they dont all hit the ground at once.
how did flooding of the nile river help the egyptians?,floodwaters were a source of nutrients along the floodplain.
rocks that deform plastically under compressive stresses crumple into this.,folds
this type of stress creates folds.,compression
an anticline in three dimensions is a basin.,false
a dome is a structure made when rocks arch upward.,true
"if a dome is eroded away, what are the ages of the rocks from inside to outside.",oldest in the inside; youngest in the outside.
an anticline has rocks that bend.,upward
the michigan basin is made by rock bending,downward
"when rocks are bent into a fold, they may go back to their original shape if the stress is released.",false
"in a syncline, the youngest rocks are outside and the oldest rocks are in the center.",false
earth formed,at the same time as the other planets.
scientists think that meteorite bombardment was extremely common on the early earth because,the moon has lots of ancient impact craters.
"due to gravity, planetoids got larger and larger until they became planets.",true
which is not a reason why earth was molten in its early days?,the sun
there was more radioactive decay early in earth history than now because many radioactive elements have long half lives.,false
differentiation,all of these.
earths first crust probably,recycled into the mantle due to vigorous convection.
the oldest materials geologists found on earth thus far are,zircon crystals in ancient rocks.
gravity releases energy when material is squeezed so hard that the pressure swells.,true
apollo astronauts brought back a rock from the moon that is,100 million years younger than the formation of the solar system.
the size of the moon is comparable to the planet ___________.,mercury
the moon is similar in composition as the planet,earth
the story of how the moon formed had to account for,earths faster than expected spin.
the moon formed at the same time earth formed.,false
the ________ ratios of moon and earth indicate that they originated in the same part of the solar system.,oxygen isotope
moons story began when,a mars-sized asteroid hit earth.
the material that came together to form the moon was flung into space from,earth.
the genesis rock is a piece of the moons original crust.,true
"in the early solar system, there was a lot of debris  asteroids, comets and planetoids - flying around.",true
the solar system formed nearly _________ years ago,5 billion
the major bodies of the solar system formed,"in this order: sun, inner planets, outer planets, asteroids, comets."
a nebula is,a giant cloud of dust and gas
"the nebular was drawn together by gravity, which released kinetic energy.",false
the sun formed in the center of the nebula because,all of these.
the planets formed because,clumps of material continued to collide due to gravity.
the planets are sorted by density outward from the sun because of,gravity
the inner planets are made primarily of,dense rock and metal.
the nebular hypothesis explains why,the oldest rocks scientists have dated are about the same age.
materials that on earth are liquids or gases are solids in the outer planets.,true
fossil fuels are compounds of _________________.,carbon and hydrogen
hydrocarbons in solid form are called _________________.,coal
hydrocarbons in gas form are called __________________.,natural gas
how do fossil fuels form?,biological remains are buried beneath masses of sediment and exposed to high heat and
what is the original source of energy for fossil fuels?,the sun.
methane is a molecule made with one carbon and _____ hydrogen atoms.,four
fossil fuels are a very poor source of energy.,false
what is the biggest downside our dependence on fossil fuels for energy?,they are non-renewable.
most of the fossil fuels we use today formed hundreds of millions of years ago.,true
"being nonrenewable resources, fossil fuels will last on the order of decades for coal and centuries for oil and natural gas.",false
oil from shale is different from oil from petroleum because it is,is dispersed through rock.
"although petroleum, coal and natural gas will eventually run out, tar sands and oil shale will be available for centuries at no more cost than traditional sources of fossil fuels.",false
if people everyone in the developed world froze their use of oil at its current level the annual amount of oil used would not increase.,false
much of the concern about the dangers of fracking is due to,the chemicals that are in the fracking fluids.
_________ are rocky materials mixed with very thick oil.,tar sands
"as of today, fossil fuel provides about ______ of the worlds energy.",85%
what is a reason tar sands are strip-mined rather than pumped?,tar sands are too thick to pump.
the keystone xl pipeline is controversial because the oil it carries could cause environmental damage.,true
the environmental consequences of obtaining energy from tar sands include,"using a lot of water that must be heated, plus caustic chemicals."
"freshwater ecosystems include lakes, ponds, streams and wetlands.",true
__________________ is the study of bodies of freshwater and the organisms that live there.,limnology
which of these organisms would you not find in the deep-water zone of a lake?,photosynthesizers
the sloped side of a lake where sunlight penetrates is the,littoral zone
wetlands are,the only home for some specialized species.
marshes are distinctive because,grasses and reeds are common.
swamps are distinctive because,"they can have freshwater, salt water or a mixture of both."
wetlands make up more than 30% of the land in the u.s. but have only 5% of the plant types.,false
wetlands never contain more than a few trees.,false
galaxies can contain billions or trillions of stars.,true
earth is a part of the _____________.,milky way galaxy
the closest galaxy to us is the ____________.,andromeda galaxy
which of these is not a type of galaxy?,circular
the arms in a spiral galaxy tend to be __________ because they contain __________.,blue; young stars
irregular galaxies may be deformed by gravitational attraction to another galaxy.,true
what is true about dwarf galaxies?,they are relatively small and dim.
the geologic time scale was originally based,entirely on relative ages.
time units on the geologic time scale are,separated by important events in geological or biological history.
"if earth history is condensed into one calendar year, dinosaurs appear",in mid-december.
"if earth history is condensed into one calendar year, the first modern humans appear",on the night of december 31st.
naming time periods makes it easier to talk about them.,true
about 1/8 of earth history passed before the explosion of life forms in the cambrian.,false
many of the blocks of time on the geologic time scale were named for,nearby towns where the rock layer from that time were found.
"eon, era, period, epoch is the order from the largest amount of time to the smallest amount of time.",true
"compared with older time periods, more recent time periods on the geologic time scale",are divided into more segments.
force per unit area that is placed on an object.,stress
rocks that are pulled apart are under,tension
parallel forces moving in opposite directions are,shear
a sudden stress is more likely to make a rock fracture than a show increasing stress.,true
stress that causes a material to change its shape is called,deformation
rock that returns to its original shape when the stress is removed.,elastic deformation
rocks that break under a lot of stress.,fracture
tension occurs at divergent boundaries.,true
this type of stress occurs at convergent boundaries.,compression
california is the best developed location in the u.s. for geothermal energy because,it is geologically active and heat sources are close to the surface.
where does geothermal energy come from?,earths internal heat
"to harness geothermal energy,",all of these.
electricity is generated at a hydrothermal plant when,steam from a geothermal well spins a turbine.
geothermal energy creates greenhouse gases and other pollutants.,false
"at any geothermal plant, the energy will run out as cold water cools the hot rock.",false
this country gets about one fourth of its electricity from geothermal sources.,iceland
geothermal energy,is useful as it is harnessed.
the likely source of heat for the largest geothermal plant in california is a large magma chamber.,true
"in some locations, hot rocks are too deep to be used for geothermal energy.",true
where are glaciers found?,every continent except australia
"large glaciers that cover a larger area than just a valley, possibly an entire mountain range or region.",ice caps
a deep crack in the glacier that forms as a result of ice movement.,crevasse
the lower part of the glacier where the amount of snow and ice that melts off is the,zone of ablation
"when a glacier no longer moves, it is called an ice sheet.",true
glacier national park has lost many of its active glaciers because,temperatures in that region have been rising.
glaciers are a resource because,they are a source of water in the summer.
"gem glacier in glacier national park is no longer moving, but it is still a glacier.",false
global average temperatures are increasing and we are already seeing the effects of this.,true
"temperatures have been rising since __________, but the __________ is increasing.",the end of the pleistocene; rate of increase
"_________ is the largest emitter of greenhouse gases, but ________ is the largest per capita emitter.",china; the united states
"when ice caps melt, the sea level decreases.",false
warmer temperatures are causing coral reefs to,turn white.
burning fossil fuels adds greenhouse gases to the air.,true
"permafrost is melting, but its extent is increasing.",false
"to find a location that it is more suited to in temperature, a species will",move uphill.
"in california and elsewhere, warmer temperatures are causing",changes in the ecology of the state.
gravitational force depends on _____________.,both a and b
"the greater an objects mass, the greater the force of attraction.",true
"the farther the distance between two objects, the greater the attraction.",false
this famous scientist was first to discover the principal of gravity.,sir isaac newton
which of these planets experiences the weakest gravitational pull to the sun?,neptune
which of these planets experiences the strongest gravitational pull from the sun?,mercury
which of the planets in our solar system has the greatest gravitational pull?,jupiter
"if you are on the top of a mountain and drop an apple, it will fall to the ground, even though the apple is gravitationally attracted to you. why?",earth is larger and has a much stronger gravitational pull.
"the planets are all really far from the sun, but they continue to orbit the star because",the sun and the planets are all really large.
"volcanic eruptions, decomposition of plant material, respiration, and fossil fuel burning all release this greenhouse gas.",carbon dioxide
how is the atmosphere like a greenhouse?,greenhouse gases trap heat like the walls of a greenhouse.
"energy that comes off of earths surface,",a & b
all greenhouse gases are emitted by natural processes.,false
which of these is the most abundant greenhouse gas?,carbon dioxide
"one cfc-12 molecule traps 10,600 times as much heat as one co2 molecule.",true
greenhouse effect is,a natural phenomenon that is important for making earth habitable.
what happens when greenhouse gas levels in the atmosphere increase?,the atmosphere traps more heat.
"in an aquifer, pore spaces above this line do not contain water and below this line do contain water.",water table
"in a drought, the water table",will go down.
people have learned to tap groundwater sources that were previously out of reach by,drilling wells.
if you were going to drill a well into an aquifer it would be a shorter distance to drill down into a valley than down into a hill.,true
the surface of a stream is,the top of the water table.
"in a desert, water only runs in streambeds (called washes) during a large rainstorm. why do streams not run in washes all the time?",the water table is too deep and does not intercept the streambed.
all springs flow all year round.,false
"to be a good aquifer, the only important quality for a rock to have is high porosity.",false
wells may go completely dry if they are not deep enough to reach in a lowered water table.,true
which of these regions has intense droughts and reduced groundwater levels?,south
this aquifer supplies one-third of the irrigation water in the united states.,ogallala
"land in some places, like the san joaquin valley of california, has undergone subsidence, which is due to",overpumping groundwater.
"in coastal regions, when an aquifer gets low, this might happen.",salt water intrusion
"when a water table decline, wells must be drilled deeper.",true
groundwater is a stable supply of water and can never be depleted.,false
the water in the ogallala aquifer is mostly from the last ice age.,true
the dust bowl will not be repeated as long as we continue to,pump water from the ogallala aquifer.
"more than 100,000 tanks of toxic substances are currently leaking underground.",true
this much of the municipal groundwater supplies in the united states are polluted.,45%
what is a pollutant plume in an aquifer?,contamination that travels from the pollutant source in the direction of flow.
about 25% of groundwater in the united states is polluted.,true
groundwater is often contaminated by,all of these.
a contaminated well will be located,anywhere.
groundwater that moves through the rock aquifer for years is decontaminated and drinkable.,false
human population reached its first billion in which year?,1802
"in 2011, the human population increased to ___________.",7 billion
"by the end of the 21st century, the human population is estimated to reach",10 billion
which can contribute to overpopulation?,low mortality rate
human population grows because,all of these
the rate at which the human population is growing is decreasing.,false
limiting factors on human population in local regions include,"space, clean air, clean water and food."
limiting factors on human population worldwide include,nothing. there are as yet no limiting factors on human population growth worldwide.
"by the end of the 21st century, the human population is expected",to increase by more people than were even alive in 1960.
as for future population growth,the rate that the rate the population is growing is decreasing.
"gasoline, used motor oil, battery acid and brake fluid are toxic chemicals from",the automotive industry.
paints are hazardous because they are,a & b
dry cleaning chemicals are hazardous because they __________.,may cause cancer in humans
human blood is,a medical waste.
what does corrosive mean?,it destroys by chemical reactions
toxic chemicals are all right if they are stored and used properly.,true
which of these is corrosive?,batteries
how can you can get rid of hazardous waste safely?,follow the rules for each toxic material.
only this much of the solar radiation reaches the surface of the earth.,half
the equatorial regions albedo is low because the region is heavily forested.,true
the amount of incoming solar radiation is the same at all latitudes.,false
night and day each last 6 months in the polar regions.,true
about 90% of the solar radiation that strikes the top of the atmosphere is filtered out before it reaches the ground.,false
what happens to the suns radiation that strikes the ground?,all of these.
why is the albedo in the polar regions high?,the polar regions have a lot of snow and ice.
where is the number of day and night hours closest to equal all year?,the equator.
why isnt earths heat budget balanced?,because the amount of incoming heat is greater than the amount outgoing heat.
"if more heat enters the earth system than leaves it, then",the planet will warm.
the transfer of energy between two objects by electromagnetic waves.,radiation
heat moving from more heat to areas of less heat by direct contact.,conduction
"conduction is more effective at higher altitudes, where air density is lower.",false
solar energy coming through space is transferred by,radiation
what drives the water cycle?,the sun
the suns rays strike the surface most directly at the equator.,true
a spoon getting warmed by boiling water is an example of this.,conduction
why do the poles receive less solar radiation than the equator?,the suns rays strike obliquely and only during the summer.
what causes a heat wave?,a & b
heat waves have increased in frequency and duration in recent years.,true
a region is having a heat wave when it is experiencing more than _____ consecutive days of temperatures more than _____ above the average.,5; 9of (5oc)
wildfires are increasingly common in the western united states due to an extended,drought
"three months with average daily high temperatures above 100of is normal for phoenix, arizona, but six days of 100of temperatures in portland, oregon is a heat wave.",true
droughts in the 1930s were a major factor in causing this event.,the dust bowl
"people survive in phoenix, arizona in intense heat because they are hardier than people in other locations.",false
what are some consequences of droughts?,all of these.
"more people die in heat waves than in blizzards, tornadoes or hurricanes.",true
hot springs are cooler than geysers.,false
hot springs or geyers are created when,water comes into contact with hot rock.
bison use the hot springs in yellowstone to stay warm in the winter because the hot springs do not freeze.,true
this results when water that is trapped becomes superheated until finally the pressure builds enough for it to break the seal of the earths crust.,a geyser
geysers,erupt because superheated water is trapped until the pressure builds enough for the
"as far as the worlds geysers go,",half are found in the united states.
old faithful geyser is noteworthy for the frequency and predictability of its eruptions.,true
hot springs are only found in the tectonically active western united states.,true
at least two of the hot spring areas in the continental u.s. are,above supervolcanoes
the heat that creates the geysers at yellowstone national park is due to,a hotspot beneath the area.
collections of fossils are known as,fossil assemblages
nicholas steno in 1666 said that fossils were once part of living creatures because fossils from far inland looked like the teeth of a freshly caught great white shark.,true
marine fossils found in tall mountains were,once part of living creatures.
almost every single organism that has ever lived became a fossil.,false
which will more likely result in a fossil?,hard shelled marine organisms die and are rapidly buried by sediment.
a ______ fossil is left behind when the soft parts have decayed away.,body
"_______ fossils are burrows, tracks, or fossilized coprolites (feces).",trace
the la brea tar pits in los angeles is an example of an unusual circumstance in which a variety of fossils are preserved.,true
soft parts of an organism are never preserved so life before the evolution of hard parts is a complete mystery.,false
this ocean current helps to moderate the temperature in europe.,the gulf stream
water in the gulf stream travels along the equator and is cooled as it goes.,false
ocean currents transfer energy from the,equatorial region to the polar regions.
which of the following is not true about the gulf stream?,it has a large temperature affect on the eastern united states and canada.
the equator and poles would have even more different climates if it werent for surface ocean currents.,true
"quebec, canada and london, england have different climates because they are at different latitudes.",false
the energy in the gulf stream could supply the world with energy 100-times over.,true
what would happen to the climate of northern europe if the gulf stream stopped flowing?,it would get much colder and would snow instead of rain.
"the gulf stream flows up the eastern u.s., but it has a much greater effect on the climate of northern europe. why?",the prevailing winds at those latitudes are from west to east.
london gets a lot of rain because,"the gulf stream warms the air above it so that it can hold more moisture, which it drops"
________ and modern humans had a common ancestor as recently as about 7 million years ago.,apes
humans evolved during the later,cenozoic
humans evolved directly from chimpanzees.,false
"homo sapiens evolved about 200,000 years ago.",true
homo erectus,began to develop culture.
"the human ancestor, ______________, lived between 3.9 and 2.9 million years ago, was bipedal and had a brain larger than a chimp.",australopithecus afarensis
modern humans are in the species,homo sapiens
"scientists are certain that our ancestors had a spiritual life at around 32,000 years ago as evidenced by their carved stone figurines.",false
"during the ice ages, humans walked over ________ from the old world to the new world.",the bering strait
igneous rocks are classified by their,texture and composition.
ultramafic igneous rocks have the lowest amount of silica of any igneous rocks.,true
the composition of an igneous rock is related to the rocks,density.
the mineral quartz is likely to be found in __________ rocks.,felsic
granite is a type of felsic rock.,true
"if you were trying to identify a light colored igneous rock with tiny crystals, you would look at these rock types",felsic extrusive
granite and andesite have the same composition but different texture.,false
gabbro and basalt have the same composition but different texture.,true
temperature increases are predicted to happen,in the polar regions more than in the equatorial regions.
"if nothing is done to shift society away from using fossil fuels,",the rate of increase in emissions will continue to increase.
water shortages will become a problem in some areas because,reduced snowpack and earlier spring will reduce snowmelt as a summer water source.
even an increase of global temperature of 1oc would make a difference to earths environment.,true
global warming has affected the south pole more than the north pole.,false
predictions for what will happen in the future with our climate,"are not well known, but the trends are clear."
temperatures are rising globally. how much they rise in the future depends on our actions in the next decades.,true
the entire increase in global temperatures seen in the past two decades was caused by,none of these.
"oceans are becoming more acidic, which means that",organisms with carbonate shells will have a more difficult time growing.
a decrease in snow pack can cause a shortage of the summer water supply in many regions.,true
which of the following is true of mercury pollution?,mercury is a pollutant that easily travels far from where it was released.
the superfund act of 1980 requires,companies to clean up toxic waste sites they are responsible for.
"at love canal, barrels of toxic chemicals were",buried and covered with soil.
"at love canal, people were told of the toxic chemicals buried beneath their homes and school when the community was built.",false
lead poisoning was a problem in the 1970s and 1980s but that has been cleaned up.,false
"groundwater in woburn, massachusetts contained this chemical, which was correlated with increased illnesses, such as leukemia, in children.",tce
how do cancer cases cause scientists to suspect contamination as the cause?,a cluster of cancer cases above the normal number causes suspicions.
which age group is the most susceptible to health problems from toxic metals?,children because they are growing rapidly.
the atmosphere is composed of 78% __________ and 21% __________.,nitrogen; oxygen
photosynthesis helps plants create __________ from __________.,food energy; solar energy
the atmosphere is a reservoir for water.,true
"in space, no one can hear you scream, because there is not medium for the sound waves to travel through",true
the ozone molecule is made of,three oxygen atoms
the red chlorophyll hotspots on the chlorophyll map are directly related to the excess nutrients in those areas.,true
"without oxygen in the atmosphere, there would be",no animals.
