question,answer
A geologist would be most likely to investigate how,mountains form.
Which type of Earth scientist might look for petroleum for an oil company?,geologist
Chemical oceanography is the study of the,naturally occurring elements in ocean water.
The problem of global warming is most likely to be the focus of a scientist known as a,climatologist.
Which type of Earth scientist would you expect to give a weather report?,meteorologist
study of Earths weather,meteorology
study of earthquakes,seismology
study of Earths oceans,oceanography
study of solid Earth,geology
study of human effects on Earth,environmental science
study of all aspects of planet Earth,Earth science
study of the universe,astronomy
Earth science is a branch of geology.,false
Some geologists specialize in the study of soil.,true
Rock layers below Earths surface are a record of Earths history.,true
The science of oceanography started with mapping the oceans.,true
Scientists have not yet visited the deepest parts of the ocean.,false
Most of Earths water is in rivers and lakes.,false
Humans have had relatively little impact on the oceans.,false
There are several branches of oceanography.,true
Meteorologists study meteors.,false
The burning of fossil fuels contributes to global warming.,true
Flowing water can cause erosion by dissolving minerals in rocks.,true
More slowly flowing water can carry larger sediments.,false
The size of sediments determines how they are carried by flowing water.,true
Clay and silt are carried in flowing water by suspension.,true
Runoff is only a minor cause of soil erosion.,false
Rapidly flowing mountain streams cause little deposition.,true
Slowly flowing rivers erode their channels more at the bottom than at the sides.,false
Floodplains are poor places for growing crops.,false
A levee forms from the largest sediments a river carries.,true
Sinkholes are caused by groundwater erosion.,true
broad flat area on both sides of a river where it floods its banks,floodplain
underground hole or cavern eroded by groundwater,cave
deposit that forms when a mountain stream flows suddenly onto flatter land,alluvial fan
raised strip of sediments deposited along the bank of a river,levee
hole on the surface of the ground that forms when a cave collapses,sinkhole
triangular deposit that forms when a river empties into a body of still water,delta
body of water that forms when a meander is cut off from the rest of the river,oxbow lake
Erosion is always followed by,deposition.
A waterfall forms when a stream flows,from harder to softer rocks.
"When flowing water slows down, which of the following sediments does it drop first?",gravel
Which statement about stalactites is false?,They form on the floors of caves.
What forms when a river erodes the outside of a curve and deposits sediments on the inside of the curve?,meander
landform that results when a sandbar builds up enough to rise above the waters surface,barrier island
artificial barrier parallel to a shore that reduces beach erosion,breakwater
landform that results when waves create a hole in a wave-cut cliff,sea arch
artificial barrier perpendicular to the shore that reduces erosion by longshore drift,groin
landform that results when waves erode the top of a sea arch,sea stack
underwater ridge of sand running parallel to shore that is deposited by waves,sandbar
ridge of sand extending out from shore that is caused by longshore drift,spit
Sediments you are most likely to find on a beach include,pieces of shell.
Erosion by ocean waves can cause,cliffs.
Landforms created by longshore drift include,spits.
A breakwater is most similar to a,barrier island.
Landforms caused by ocean wave deposition include,sandbars.
Which series of landforms shows the correct order in which a stretch of rocky shoreline may be eroded?,"cliff, sea arch, sea stack"
Bigger waves can carry more sediment.,true
The smallest sediments in ocean water are deposited on the shore.,false
Most waves strike the shore at an angle rather than straight on.,true
Longshore drift carries sediments far inland.,false
Groins are built to prevent the formation of sandbars.,false
Sediment in ocean water scrapes rocks like sandpaper.,true
Longshore drift moves sand opposite to the direction of prevailing winds.,false
The end of a spit may hook around toward the open ocean.,false
A barrier island is generally small and round in shape.,false
Sand collects on both sides of a groin.,false
Glaciers presently cover about 40 percent of Earths surface.,false
Continental glaciers are long and narrow.,false
Valley glaciers flow downhill through river valleys.,true
Continental glaciers form cirques and horns.,false
A glacier picks up sediments when they freeze to ice at the bottom of the glacier.,true
The narrow end of a drumlin points in the direction that the glacier moved.,true
All glaciers move because of gravity.,true
The main way glaciers cause erosion is by ice wedging.,false
Glaciers are getting smaller because of global warming.,true
The valley carved by a mountain glacier has gently sloping walls.,false
rounded hollow carved in the side of a mountain by a glacier,cirque
type of glacier that is spread out over a large area,continental glacier
long low hill of sediments deposited by a glacier,drumlin
type of glacier that forms in mountains,valley glacier
winding ridge of sand deposited by a stream of meltwater,esker
jagged ridge that remains when two cirques form on opposite sides of a mountain,arte
sharp peak that is left behind when glaciers erode all sides of a mountain,horn
"Today, continental glaciers cover most of",Greenland.
Features caused by valley glacier erosion include,cirques.
A trimline shows the,highest level a valley glacier reached.
A headwall is the,highest cliff of a cirque.
A valley glacier changes a V-shaped river valley to a,U-shaped valley.
A thick layer of sediments left behind by a retreating continental glacier is called,ground moraine.
The last time glaciers dipped as far south as Chicago and New York City was,"12,000 years ago."
Examples of imprint fossils made by compression are,fossil leaves
Fossilized insects have been found preserved in amber which is hardened,tree sap
Fossilized stomach contents may indicate,a b
An animal is more likely to a fossil if it:,is buried deeply in the ground
Marine fossils on the top of Mt. Everest indicate,the rock at the top of Mt. Everest was once under water
Preserved traces can include burrows.,true
Scientists have discovered fossil footprints.,true
Complete preservation occurs only when remains are preserved in rock.,false
"In the past, fossils inspired legends of monsters.",true
It is very likely that any given organism will become a fossil.,false
Fossils in older rocks are more similar to animals that live today than fossils in younger rocks.,false
Fossils of ocean animals have been found at the top of Mt. Everest.,true
Fossils form when remains are replaced by minerals.,true
Fossils show that Antarctica once had a much warmer climate.,true
Index fossils are the first fossils ever discovered of an extinct species.,false
Complete preservation is valuable because scientists can study the organisms DNA.,true
There are no plants in Antarctica so there are no plant fossils there.,false
Teeth are more likely than feathers to be preserved as fossils.,true
People first started discovering fossils about 150 years ago.,false
All fossils form when remains of dead organisms are covered with sediments.,false
dark stain in rock left by the remains of an organism,compression
preserved tracks or other evidence of an organism that lived in the past,trace fossil
type of fossil that can be used to determine the age of rock layers,index fossil
process by which remains or traces of living things become fossils,fossilization
type of fossil that forms in a mold,cast
any preserved remains or traces of an organism that lived in the past,fossil
imprint of an organism left in rock,mold
Which of the following parts of organisms are most likely to be fossilized?,shells
Preserved traces of organisms might include,feces.
Preserved remains that have become fossils have turned to,rock.
Which type of organisms remains are least likely to be preserved as fossils?,jellyfish
"To be used as index fossils, fossils must represent an organism that",lived over a wide area.
Earths geologic processes have changed over time.,false
Extinction occurs when a species completely dies out.,true
The Law of Superposition states that,older rocks are found below younger rocks
Layers of sedimentary rock are called strata.,true
The rock layers at the Grand Canyon,are the same on opposite sides of the river.
A good key bed must be,found over a large area
The relative age of a rock is its approximate age in years.,false
Rock layers on opposite sides of the Grand Canyon show lateral continuity.,true
A good index fossil,is distinctive
Key beds are rock layers that have unconformities.,false
More than one type of index fossil provides stronger evidence that rock layers are the same age.,true
The Cretaceous Period ended when the first dinosaurs appeared.,false
The earliest geologic time scale showed how many years ago each era began.,false
Fish were common organisms during the Paleozoic Era.,true
"Fossil B is younger than Fossil A, but the rock layer containing Fossil B is beneath the rock layer",true
"To help decipher the geologic history of a region, create a geologic time scale using the rock units you",false
James Hutton thought Earth was old because he saw how slowly geological processes work now.,true
Cross-cutting relationships help geologists to determine the older and younger of two rock units.,true
"In the process of relative dating, scientists determine the exact age of a fossil or rock.",false
whether a rock is older or younger than other rocks,relative age
law stating that rock layers are deposited in horizontal layers,original horizontality
law stating that rock layers closer to the surface are younger than deeper rock layers,superposition
law stating that rock layers are older than any rocks that cut across them,cross-cutting relationships
gap in a sequence of rock layers,unconformity
law stating that matching nearby rock layers are the same age,lateral continuity
study of rock layers,stratigraphy
"If sedimentary rock layers are tilted, they must have",moved after they formed.
A key bed of clay from around the time the dinosaurs went extinct led to the hypothesis that the extinction was caused by a,giant asteroid.
Evidence shows that Earth is about,4.5 billion years ol
Eons of the geologic time scale are divided first into,eras.
The Cenozoic Era is called the age of,mammals.
What does the term paleozoic mean?,old life
Many of the divisions of the geologic time scale mark major events in the history of,life.
How much percent of the parent isotope remains after 2 half-lives?,25%
The half-life of a radioactive element is,the time it takes for half a parent isotope to decay into the daughter isotope
Carbon dating is useful for,organic materials
Potassium-argon is better for dating igneous rocks than carbon-14 because,the potassium-40 half-life is long
"For radiometric dating of Earths oldest rocks, it is best to use",uranium-238 to lead-206
The number of protons in atoms of the same element may vary.,false
Almost all carbon atoms are atoms of carbon-14.,false
"When an atom of carbon-14 decays, it loses an electron.",false
Using radioactivity scientists are able to measure the relative age of some rocks.,false
Carbon-14 atoms decay to carbon-13 atoms.,false
Radioactive isotopes gain or lose particles to become different elements.,true
The half-life of a radioactive isotope is constant.,true
A living thing takes in carbon-14 only while it is alive.,true
No one knows Earths age because no isotopes are good for substances that old.,false
Carbon-14 dating can be used to determine the ages of rocks.,false
"Carbon-14 loses an alpha particle, which is two protons and two electrons.",false
Plants take in carbon-14 during photosynthesis.,true
The half-life of carbon-14 is 5730 years.,true
All fossils can be dated with carbon-14 dating.,false
"To date a rock that is as old as Earth, you could use potassium-40 dating.",false
Absolute ages are based on evidence from,radiometric dating.
Which of the following atomic particles may vary for atoms of a given element?,neutrons
How many protons are found in each atom of carbon-14?,6
"If a carbon atom has 7 neutrons, it is the isotope named",carbon-13.
Plants use carbon dioxide for the process of,photosynthesis.
New atoms of carbon-14 form in the atmosphere because of,cosmic rays.
"If you start with 1.00 g of carbon-14, the amount left after two half-lives will be",0.25 g.
using radioactive decay to estimate the age of a fossil or rock,radiometric dating
radioactive element with a relatively long half-life,uranium-238
rate of decay of a radioactive element,half-life
atom of an element with a different number of neutrons,isotope
stable isotope of carbon,carbon-12
radioactive element with a relatively short half-life,carbon-14
breakdown of unstable elements into stable elements,radioactive decay
ring of icy debris just beyond Neptune,Kuiper belt
Before the Sun formed,temperature and pressure was extreme
example of an object in the solar system,comet
The densest part of planet Earth is the,core
water in the gaseous state,water vapor
The Sun formed from,a spinning cloud of gas and dust
When the solar system first formed,asteroid impacts were common
gas missing from Earths early atmosphere,oxygen
reaction in which hydrogen atoms change to helium,nuclear fusion
Gases in the first atmosphere came from,both of these
giant cloud of gas and dust from which the solar system formed,solar nebula
gases that surround a planet,atmosphere
The solar system formed from a giant mass of gas and dust.,true
The sun formed billions of years before other objects in the solar system.,false
The solar nebula formed a disk before it formed the sun.,true
"The first atmosphere contained nitrogen, carbon dioxide, oxygen, and hydrogen.",false
Objects in our solar system include dwarf planets.,true
All of the stars in the Universe formed at around the same time as our Sun.,false
"As Earth formed, gravity pulled lighter materials to the center of the planet.",false
Earths mantle is made entirely of liquid rock.,false
"The Sun, planets and other solar system objects formed at about the same time.",true
There was a lot of space debris in the early solar system.,true
Early Earth was much like Earth today.,false
"Before there was an ocean, there was water vapor in the atmosphere.",true
Earths moon began as a dwarf planet orbiting the sun.,false
"From the time it first formed, Earth has always had an atmosphere.",false
Some of the gases in Earths early atmosphere came from comets.,true
Our solar system began to form about,5 billion years ago.
The inner planets of our solar system include,Mercury.
"After the sun formed, material at similar distances from the sun collided to form each of the",planets.
Earth formed about,4.5 billion years ago.
"After the oceans formed on Earths surface, the",water cycle began.
The fourth supercontinent to form was,Rodinia.
Earths first crust was probably made of,granite
The supercontinent in question 1 formed about,1.1 billion years ago.
The earliest life on Earth,may have been wiped out more than once
How do cells make copies of themselves?,Nucleic acids pass on genetic information
Which of the following is true?,Prokaryotes and eukaryotes both are single-celled or multicellular.
Earths earliest life forms,consisted of one cell.
The earliest organisms to photosynthesize,are still common in lakes and seas.
Continents form when,microcontinents or island arcs collide
Eukaryotes first evolved about,2.0 billion years ago.
Which of the following types of organisms evolved first?,cyanobacteria
Prokaryoes are more common than eukaryotes.,false
DNA is short for deoxyribonucleic acid,true
Rodinia was the first supercontinent.,false
Early in Earth history mantle convection was super fast.,true
The evolution from prokaryotes to eukaryotes to multi-cellular organisms took a few million years.,false
Nucleic acids in living things include DNA and RNA.,true
Continental crust first appeared on Earth about 2 billion years ago.,false
The first continents on Earth were very large compared with those today.,false
Pangaea was the first supercontinent to form on Earth.,false
Life may have originated on Earth more than once.,true
The first oxygen on Earth combined with iron to form iron oxide.,true
Some of the oxygen in Earths early atmosphere became ozone.,true
The first photosynthetic organisms were most like modern E. coli.,false
There are no longer any prokaryotes living on Earth.,false
Ediacara fauna evolved toward the end of the Precambrian Era.,true
first organisms to make food by photosynthesis,cyanobacteria
type of organism that contains a nucleus in its cell(s),eukaryote
process that added oxygen to Earths early atmosphere,photosynthesis
gas that protects Earth from harmful radiation,ozone
type of organism that lacks a nucleus in its cell(s),prokaryote
organic compound that stores genetic information,nucleic acid
waste product of photosynthesis,oxygen
About what percent of Earths surface is covered with water?,70 percent
Water is stored in,all of these
What percent of Earths total water is fresh water?,3 percent
The largest amount of fresh water is contained in,"ice caps, glaciers and inland seas"
Most of Earths liquid fresh water is located in,underground rocks.
The water cycle,has no beginning and has no end.
The energy for the water cycle comes from,the Sun
Most fresh water enters the atmosphere when water evaporates from,oceans.
Clouds form when water vapor,condenses.
"In infiltration, water goes",through the ground
Water vapor enters the atmosphere through,transpiration.
Icebergs are made of frozen salt water.,false
Almost 80 percent of Earths fresh water is frozen.,true
There is more water in Earths living things than there is in the atmosphere.,false
Soil moisture is important for plants to grow.,true
Some water molecules may be billions of years old.,true
Water exists on Earth in all three states of matter.,true
The water cycle has no beginning or end.,true
Water can go through the water cycle without changing state.,false
Water turns to gas through condensation.,false
Most condensation of water takes place in the oceans.,false
The atoms that make up water molecules come together and break apart easily.,false
Cold air can hold less water than warm air so when air cools water may condense.,true
Water that forms clouds always falls to the ground as precipitation.,false
"Runoff may pollute rivers, lakes, and oceans.",true
Most of Earths precipitation falls on land.,false
water that falls from clouds to Earths surface,precipitation
"continuous movement of water through the oceans, atmosphere, land, and living things",water cycle
process in which plants release water vapor through their leaves,transpiration
precipitation that flows over the surface of the ground,runoff
process in which water vapor changes to liquid water,condensation
process in which liquid water changes to water vapor,evaporation
process in which water soaks into the ground,infiltration
The Great Lakes,are the worlds largest freshwater lakes
Rift lakes form because of,plate tectonics.
Lakes,are often the result of glaciation
Wetlands that have trees include,swamps.
A stream is,any water that flows downhill in a channel
A broad curve in a river is a,meander
A bog is generally covered with,mosses.
Why are wetlands useful?,They reduce the risk of floods.
Two water droplets fall on opposite sides of a divide. Those droplets will,eventually end up in two different oceans
A small stream that flows into a bigger stream is called a,tributary.
"When a river reaches its mouth, it may drop its sediment and form a",delta.
A brook is a type of wetland.,false
A stream always flows from a higher to a lower elevation.,true
The bottom of a river channel is called the bank.,false
Streams usually begin with water from snow melt and possibly springs.,true
A single stream always has just one source.,false
A single stream will have a single water source.,false
Moving water slows down when it enters a body of still water.,true
A rivers basin is also called its bed.,false
The Great Lakes are in basins carved by glaciers.,true
A divide is the lowest point between two river basins.,false
A stream is a small river.,false
A floodplain may be very wide and flat.,true
All lakes have fresh water.,false
Sunlight may not be able to reach the bottom of a deep lake.,true
The Great Lakes are volcanic lakes.,false
small body of standing water,pond
event in which a body of water overflows its banks,flood
area that is covered with water or has soggy soil during all or part of the year,wetland
any body of fresh water that flows downhill in a channel,stream
large body of fresh water that flows downhill in a channel,river
large body of standing water,lake
all of the land drained by a river system,watershed
Groundwater usually,flows very slowly between grains of sediment
What are the two features of a good aquifer?,high porosity and high permeability
"During very wet times, the water table will",rise
Water replenishes an aquifer from,all of these
Geysers erupt because,pressure builds until the water breaks through
The water table in an area may rise or fall.,true
An aquifer usually forms in a layer of clay.,false
The rock layer below an aquifer always consists of permeable rock.,false
Water in hot springs is heated by hot magma.,true
Very few land areas have aquifers beneath them.,false
Aquifers are generally found at the same depths.,false
It is impossible for an aquifer to ever run dry.,false
The Ogallala aquifer is one of the biggest aquifers in the world.,true
Land use in an area can affect the amount of water that is available to enter groundwater.,true
Much of the water taken from the Ogallala aquifer is used to irrigate crops.,true
A good aquifer has rock in it that is porous and permeable.,true
The bottom layer of an aquifer has impermeable rock.,true
Many hot springs are also mineral springs.,true
The water table keeps water in an aquifer from seeping deeper underground.,false
Water flows out of a well due to gravity.,false
not having tiny holes that water can pass through,impermeable
underground rock layer that is saturated with water,aquifer
having tiny holes that water can pass through,porous
top of an underground rock layer that is saturated with water,water table
hole dug or drilled into the ground to reach an aquifer,well
fresh water below Earths surface,groundwater
water that enters an aquifer,recharge
Water infiltrates the ground where rock is,permeable.
The water in an aquifer is more likely to be polluted if the aquifer,is close to the surface.
The Ogallala aquifer is an important source of water in the American,Midwest.
Water in a spring comes from a,layer of rock.
The majority of Earths liquid fresh water is found in,rocks.
An aquifer is recharged by,surface water.
Rock that holds as much water as possible is said to be,saturated.
Sources of water vapor in Earths very early atmosphere included,volcanic eruptions.
What percent of the Earth is covered in salt water oceans?,71%
Coastal areas have a milder climate than inland areas because,all of these
Ocean water everywhere has a relatively moderate temperature because,water flows throughout all the worlds oceans.
"Compared with shallow water, deeper water is",saltier and colder
Salt in the oceans comes from,river inflow
Some ocean zones are based on,depth of water.
Which ocean zone receives a lot of sunlight and nutrients?,neritic zone
"The ocean zone that is always covered by water, but is fairly shallow in depth is the",intertidal zone
Most nutrients enter ocean water from the,land.
The oceans influence Earths atmosphere.,true
Fewer organisms live in the oceans than on the land.,false
Early Earth was too cold for liquid water to exist.,false
The Dead Sea is extremely saline due to high evaporation.,true
Oceans cover more than 70 percent of Earths surface.,true
Earths oceans have always had the same configuration.,false
Coastal areas always have colder climates than inland areas.,false
Ocean water is saltier than any other water on Earths surface.,true
Most nutrients in the ocean are washed in from the land.,true
The amount of salt in ocean water is the same everywhere on Earth.,false
"About 250 million years ago, there was one world ocean known as Pansea.",false
The climate of inland areas is affected by oceans.,true
The water may be very deep in the neritic zone.,false
Nutrients may be scarce in the oceanic zone.,true
Temperature and pressure increase as you go deeper below the oceans surface.,false
ocean zone that is closest to shore,intertidal zone
dissolved gas in ocean water,carbon dioxide
open ocean beyond the continental shelf,oceanic zone
ocean zone on the ocean floor,benthic zone
ocean zone where sunlight does not reach,aphotic zone
main salt in ocean water,sodium chloride
ocean zone that lies over the continental shelf,neritic zone
What is the primary cause of the tides?,The moons gravity
Surface currents,none of these
Where in the ocean is wave energy the greatest?,at the surface
A wave breaks because,all of these
Upwelling brings,nutrients to the surface so there is a lot of life
The highest point of a wave is its amplitude.,false
Wavelength is the difference between a crest and a trough.,false
The biggest ocean waves occur with hurricanes.,true
The greatest cause of tides is the Sun.,false
Waves break on shore because the water is shallow.,true
Tides are waves: high tide is the crest and low tide is the trough.,true
All waves are caused by winds.,false
Tides cause water levels to rise and fall once a day.,false
A wave is a transfer of energy that initially began with wind.,true
