question,answer
"If a velocity-time graph slopes downward to the right, then acceleration is negative.",true
"If velocity is not changing, then acceleration is zero.",true
A change in direction with or without a change in speed is velocity.,false
"If the slope of a velocity-time graph is a straight line, then velocity must be constant.",false
Acceleration shows,how quickly an objects velocity changes.
"If you are riding in a car that decelerates suddenly, you will feel your body",thrust forward.
"To calculate acceleration without a change in direction, you should use the formula",acceleration = v/t
"When Sara ran a race on a straight track, her speed changed from 3 m/s to 6 m/s over a time period of 3 seconds. What was her acceleration during that time?",1 m/s2
"If speed decreases, then acceleration is",negative.
Examples of forces include,friction.
"If gravity pulls you down toward the center of Earth with a force of 500 N, how much upward force does the ground exert on you?",500 N
"In the following sketch, what is the net force acting on the box?",15 N to the right
Which diagram represents balanced forces?,a
Which pair of forces in question 5 differ from each other in both strength and direction?,b
Mass is a measure of the force of gravity on an object.,false
Most objects have at least two forces acting on them at all times.,true
"If opposing forces are unequal in strength, the net force is less than zero.",false
The SI unit for weight is the newton.,true
"When two forces act on an object in the same direction, the net force equals zero.",false
"When forces act in opposite directions on an object, they are subtracted to yield the net force.",true
Every sport involves forces.,true
Forces are always balanced when they act on an object in the same direction.,false
"Whenever an object is stationary, it has no forces acting on it.",false
Two forces acting in the same direction always result in a stronger force.,true
combination of all the forces acting on an object,net force
force that a person or thing exerts on to an object,applied force
push or pull acting on an object,force
forces that produce a net force of zero,balanced forces
example of a force,gravity
SI unit for force,newton
forces that produce a net force greater than zero,unbalanced forces
Friction occurs because,all surfaces have some roughness.
Friction is greater when surfaces are,rougher.
Rubbing your hands together makes them warmer because,friction causes molecules to move faster.
"If you pick up and carry a piece of heavy furniture, which type of friction do you have with the floor?",static friction
Why is it easier to slide a heavy box over a floor that it is to start it sliding in the first place?,The box has less friction when it is sliding.
Which statement about rolling friction is false?,It is stronger than sliding friction.
Which type of friction occurs between a paddle and the water?,fluid friction
Friction is never useful.,false
Too much friction can cause parts to wear out.,true
Friction can cause scrapes on the skin.,true
Friction is a force that opposes motion.,true
Some surfaces are so smooth that they have no friction.,false
The force of friction between surfaces is always useful.,false
You use friction when you strike and light a match.,true
It takes more force to slide than to roll a heavy object.,true
Sliding friction is greater when the sliding object is heavier.,true
Friction works in the same direction as the force applied to move an object.,false
Sliding friction is stronger than static friction.,false
Rolling friction is weaker than sliding friction.,true
"When a dolly is stationary, there is rolling friction between the wheels and ground.",false
Static friction prevents you from sliding out of your chair to the floor.,true
The brakes on a bike create rolling friction.,false
type of friction between ice skates and ice,sliding friction
any substance that can flow and take the shape of its container,fluid
force that opposes motion between any two surfaces,friction
type of friction between shoes and pavement,static friction
type of friction between a parachute and air,air resistance
type of friction between roller skates and concrete,rolling friction
type of friction between an object and a gas or liquid,fluid friction
The SI unit for weight is the,newton.
The only reason that a leaf falls to the ground more slowly than an acorn is that the leaf has,more air resistance.
"On Earth, a mass of 1 kilogram exerts a downward force due to gravity of about",10 N.
Satellites orbit Earth because of gravity.,true
An object has a greater mass on Earth than it does on the moon.,false
Molecules of gas are attracted toward one another by gravity.,true
All of the solar systems in the universe formed because of gravity.,true
The mass of an object affects its force of gravity.,true
Gravity acts only between objects that are close together or touching.,false
Objects that are closer together have a weaker force of gravity.,false
All objects have the same acceleration due to gravity.,true
Earth has stronger gravity than the moon.,true
The curved path of an arrow is called its orbit.,false
Weight is measured with a balance.,false
People have known about gravity for thousands of years.,true
The moon has both forward velocity and acceleration toward Earth.,true
Einsteins theory of gravity is better than Newtons law of gravity at predicting how all objects move.,true
Einstein defined gravity as a force of attraction between objects with mass.,false
SI unit for weight,newton
motion of an object subject to horizontal force and the force of gravity,projectile motion
force of attraction between two masses,gravity
scientist who proposed that gravity is due to curves in space and time,Albert Einstein
measure of the force of gravity,weight
"path of one object around another, such as the moon around Earth",orbit
scientist who proposed the law of universal gravitation,Isaac Newton
Gravity always causes objects to,attract each other.
What does weight measure?,force
Jody has a mass of 50 kilograms. What is his weight on Earth?,500 N
The moon orbits Earth rather than the sun because,the moon is closer to Earth.
An object with greater mass,has greater weight.
Which of the following items has the property of elasticity?,rubber band
force exerted on a material that is pulled apart,stretching force
structure that returns to its original shape after being stretched or compressed,spring
force exerted on a material that is pushed together,compressing force
counter force exerted by an elastic material that is stretched or compressed,elastic force
ability of a material to return to its original shape after being stretched or compressed,elasticity
Something that is elastic springs back after being stretched.,true
An elastic material resists a change in shape.,true
Elastic force is not very useful.,false
"When you use a resistance band, resistance comes from elastic force.",true
Glass is an example of an elastic material.,false
Items that are elastic include,plastic spring toys.
"When you compress a spring, it resists the change in shape.",true
A rubber band keeps a newspaper tightly rolled because it,exerts elastic force.
Paper is an example of an elastic material.,false
"When you compress a spring, it",resists the change in shape.
"As you stretch a bungee cord, its elastic force gets stronger.",true
"When you release a stretched bungee cord, it returns to its original shape because of gravity.",false
Something that is elastic returns to its original shape after being compressed.,true
What happens when the stretching force on an elastic material is released?,The material snaps back to its original shape.
Newtons first law of motion is also called the law of,inertia.
Newtons first law of motion states than an objects motion will not change unless,the net force acting on it is greater than zero.
Overcoming an objects inertia always requires a(n),unbalanced force.
"Once an applied force causes an object to start moving, the object keeps moving because",it has inertia.
It is more difficult to start a 50-kg box sliding across the floor than a 5-kg box because the 50-kg box has greater,inertia.
"If you run into a curb on your bike, you might fly forward over the handlebars because of",inertia.
An objects velocity will not change unless it is acted on by a(n),unbalanced force.
Inertia causes a stationary object to,remain stationary.
The direction of a moving object will not change if the net force acting on it is,zero.
Inertia is the tendency of an object to resist motion.,false
Newtons first law of motion is also called the law of acceleration.,false
"If an object is at rest, inertia will keep it at rest.",true
The inertia of an object is determined by its speed.,false
Newtons first law relates motion to balanced and unbalanced forces.,true
The speed of an object changes only when it is acted on by an unbalanced force.,true
An object with greater mass has greater inertia.,true
A stationary object resists movement only because of gravity.,false
Balanced forces are needed to change an objects motion.,false
The tendency of an object to resist a change in motion depends on its mass.,true
"If the net force acting on an object is zero, its inertia is also zero.",false
A rolling ball will roll forever unless it runs into another object.,false
The tendency of an object to resist a change in its motion depends on the objects size.,false
"When you are moving at a high rate of speed, inertia makes is hard to stop.",true
Newtons first law of motion applies only to objects that are already moving.,false
combination of all the forces acting on an object,net force
force that opposes the motion of any object,friction
an objects motion will not change unless an unbalanced force acts on it,law of inertia
factor that determines the inertia of an object,mass
type of force needed to overcome inertia of an object,unbalanced force
tendency of an object to resist a change in motion,inertia
Which two factors have an inverse relationship?,mass and acceleration
Any change in the motion of an object is called,acceleration.
"In the equation F = m  a, if a is the acceleration due to gravity, what is F?",weight
"If you push a 20-kg box with a force of 10 N, what is its acceleration?",0.5 m/s2
Newton determined that the acceleration of an object depends on the net force acting on the object and the objects,mass.
The relationship between mass and inertia is described by Newtons second law of motion.,false
Newton determined that there is a direct relationship between force and mass.,true
Any change in velocity for any reason is called acceleration.,true
Newtons second law shows that there is a direct relationship between net force and acceleration.,true
"The greater the net force applied to a given object, the more it will accelerate.",true
Doubling the mass of an object doubles its weight.,true
"The greater the mass of an object, the more it will accelerate when a given net force is applied to it.",false
A net force of 1 N applied to a mass of 1 kg results in an acceleration of 0.5 m/s2 .,false
Force can be expressed as kg  m/s.,false
Your weight equals your mass multiplied by the acceleration due to gravity.,true
Any object that is accelerating is changing its speed.,false
"If a balanced force acts on an object, the object will accelerate.",false
A 10-kg object has greater acceleration due to gravity than a 5-kg object.,false
The acceleration of an object equals its mass times the net force applied to it.,false
The acceleration of an object due to gravity depends on the objects initial velocity,false
Doubling the net force acting on an object,doubles its acceleration.
"If you push a 20-kilogram mass with a force of 40 N, what will be the objects acceleration?",2 m/s2
"If you know the mass of an object, you can calculate its weight with the formula",F
"If the mass of an object doubles, its weight",doubles.
acceleration due to gravity,9.8 m/s2
formula for weight,F = m  a
formula for acceleration,a =
measure of the force of gravity pulling on an object,weight
type of relationship between acceleration and mass,inverse relationship
measure of the change in velocity of a moving object,acceleration
type of relationship between acceleration and force,direct relationship
Forces always act in pairs.,true
Action and reaction forces always cancel out.,false
Action and reaction forces are not balanced because they,act on different objects.
Action and reaction forces always result in motion.,false
Which statement about momentum is false?,Momentum is a force.
Only moving objects have momentum.,true
A smaller mass cannot have as much momentum as a larger mass.,false
The momentum of a 50-kg object moving at a velocity of 2 m/s is,100 kg  m/s
Momentum can be transferred from one object to another.,true
"When an action and reaction occur, momentum is usually lost.",false
Momentum is conserved only in head-on collisions.,false
Newtons third law of motion is also called the law of conservation of momentum.,false
Momentum is another term for acceleration.,false
Momentum is a measure of an objects velocity.,false
"If you double the velocity of an object, its momentum also doubles.",true
The law of conservation of momentum applies to actions and reactions.,true
"After two objects collide, their combined momentum is always zero.",false
A bowling ball has greater momentum than a softball if both have the same velocity.,true
how to calculate momentum,mass  velocity
SI unit for momentum,kg  m/s
equal and opposite forces that act on different objects,action-reaction forces
combined momentum of objects remains the same when an action-reaction occurs,law of conservation of momentum
property of a moving object that makes it hard to stop,momentum
equal and opposite forces that act on the same object,balanced forces
every action has an equal and opposite reaction,Newtons third law of motion
"When an action force occurs, the reaction force is always",equal and opposite to the action force.
"When you stand on the floor, the force of your body pushing down on the floor is",matched by the floor pushing up on your body.
"If the following objects are all moving at the same velocity, which of the objects has the greatest momentum?",bowling ball
Momentum is a,property of an object.
What is the momentum of a 9-kilogram object that has a velocity of 3 m/s?,27 kg  m/s
Only liquids have buoyancy.,false
Any object sinks if its weight is greater than its volume,false
Some objects float in water because the objects,weigh less than the weight of the water they displace.
A denser object weighs more than a less dense object of the same size.,true
The amount of water that is displaced when you submerge yourself in a swimming pool is equal to your bodys,volume.
The weight of the displaced water in question 3 equals the,buoyant force acting on your body.
Helium balloons float in air because helium is purer than air.,false
The buoyant force acting on an object in a fluid always equals the objects weight.,false
What happens if an object is placed in water and its density is greater than water?,The object may sink or float.
Archimedes determined that the mass of fluid displaced by an object equals the mass of the object.,false
"The more fluid an object displaces, the greater the buoyant force acting on the object.",true
Buoyancy is a property of an object that can float in a fluid.,false
Fluids exert pressure only in an upward direction.,false
Buoyant force explains why some objects float in water.,true
Objects float because fluids exert only upward pressure.,false
amount of mass in a given volume,density
Buoyancy is a property of some objects when placed in fluids.,false
force that causes an object to sink in a fluid,gravity
to remain at or near the surface of a fluid,float
"If two objects have the same volume but differ in density, the denser object will weigh more.",true
force that causes an object to float on a fluid,buoyant force
Archimedes law explains why heavy objects can float if they displace enough water.,true
The buoyant force acting on an object in a fluid depends on the total volume of the fluid.,false
act in which an object moves fluid out of its way,displacement
ability of a fluid to exert upward force,buoyancy
measure of the force of gravity pulling down on an object,weight
Which statement explains buoyant force?,Fluid pressure is greater at greater depths.
Ice cubes float on water because ice is,less dense than water.
"When you sit in a tub of bath water, the water rises because it",is displaced.
Where is water pressure greatest on an object in the water?,on the bottom of the object
You feel lighter in the water than on land because,the buoyant force of the water counters some of your weight.
unit for power that equals 745 watts,horsepower
SI unit for work,joule
Which weight lifter described below does the most work?,Tim lifts 180 N a distance of 2.3 m.
how to calculate work,force  distance
Another way of writing 1 joule is,1 N  m.
One horsepower is about equal to,745 watts.
use of force to move an object,work
how to calculate power,work  time
How much work is done by a 1000-watt hairdryer in 40 seconds?,"40,000 J"
SI unit for power,watt
measure of the amount of work that can be done in a given amount of time,power
Every time you apply a force you do work,false
A more powerful device can do more work in the same amount of time than a less powerful device.,true
The power of a machine equals the work it does multiplied by the time it takes to do that work.,false
The steam engine invented by James Watt had the power of one horse.,false
"The most powerful engines today can produce more than 100,000 horsepowers.",true
Whenever you move your body you are doing work.,true
You do work when you push a heavy object even if the object does not move.,false
Work can be expressed in the unit N  m.,true
A more powerful device can do the same work in less time than a less powerful device.,true
"If you move an object that weighs 10 newtons a distance of 2 meters, you do 5 joules of work.",false
"If you move the object in question 5 a distance of 5 meters, you do 2 joules of work.",false
A device that does 100 joules of work in 3 seconds has 300 watts of power.,false
The unit called the horsepower was introduced by James Watt.,true
A 2-horsepower device has almost 1500 watts of power.,true
"The more force you apply to move an object, the more work you do.",true
"For work to be done on an object, force must be applied",in the same direction that the object moves.
Work is directly related to the force applied to an object and to the,distance the object moves.
"If a mover pushes a box weighing 100 newtons a distance of 3 meters, how much work does she do?",300 J
The power of a device can be expressed in,joules per second.
Work can be calculated as,power  time.
A device does 2000 joules of work in 10 seconds. What is the power of the device?,200 W
One horsepower is the amount of work a horse can do in one,minute.
Machines that increase the distance over which force is applied include,hammers.
Ways that machines make work easier include,increasing force.
"If you apply 20 N of force to the handle end of a canoe paddle, how much force might the paddle end apply to the water?",10 N
"If the output work of a machine is 3000 J and the input work is 4000 J, what is the efficiency of the machine?",75%
"If the ideal mechanical advantage of a machine equals 1, then the actual mechanical advantage of the machine must be",less than 1.
The output distance of a machine is always greater than the input distance.,false
Using a machine increases the amount of work that is done for a given amount of force.,false
A machine increases the applied force by increasing the distance over which the force is applied.,false
The output force of a machine is always less than the input force.,false
The force you apply to a doorknob is less than the force applied by the doorknob to open the door.,true
All machines that change the strength of the force also change the distance over which the force is applied.,true
A machine changes the way that work is done.,true
The actual mechanical advantage of a machine is always greater than its ideal mechanical advantage.,false
All machines change the direction in which force is applied.,false
A machine that applies force over a longer distance also increases the strength of the force.,false
"If a machines output distance is greater than the input distance, the ideal mechanical advantage is less than",true
"A pry bar changes the strength, distance, and direction of the input force.",true
"If a machine changes only the direction of force, its mechanical advantage is equal to 1.",true
A lever is a machine that changes the direction of the force that is applied to it.,false
number of times a machine multiplies the input force,mechanical advantage
distance over which force is applied to a machine,input distance
percent of input work that becomes output work,efficiency
force applied to a machine,input force
any device that makes work easier by changing a force,machine
distance over which a machine applies force,output distance
force applied by a machine,output force
Examples of machines that increase force include,doorknobs.
How does a nutcracker change the force applied to it?,It increases the force that is applied.
A machine that increases the applied force and also changes its direction is a,pry bar.
Which of the following could be the efficiency of a machine?,75%
What is the mechanical advantage of a machine that increases the distance over which force is applied?,less than 1
"If the output force of a machine is greater than input force, the mechanical advantage of the machine is",greater than 1.
Which type of simple machine is a chisel?,wedge
Which type of simple machine is the head of an axe?,wedge
Which of the following is an example of a screw?,spiral staircase
Which of the following is a second-class lever?,wheelbarrow
The ideal mechanical advantage of a screw is always,greater than 1.
The ideal mechanical advantage of a pulley equals the,number of rope segments lifting up on the object.
Which statement about a wheel and axle is true?,It changes the distance over which the force is applied.
Which of the following is an example of a third class lever?,hockey stick
The ideal mechanical advantage of an inclined plane is always,greater than one.
A wheel and axle increase the applied force when,the input force is applied to the wheel.
How many rope segments pull up on the object in a single moveable pulley?,2
There are seven different types of simple machines.,false
The input distance of an inclined plane is always greater than the output distance.,true
The input force is always applied to the thinner side of a wedge.,false
The center of a wheel and axle is called the fulcrum.,false
"The closer together the threads of a screw are, the harder it is to turn the screw.",false
A wedge is used to cut or split objects.,true
"When you use a hammer to pry a nail out of board, the hammer is a first class lever.",true
A lever always increases the force applied to the lever.,false
"When you turn a screw, you apply force along its inclined plane.",true
The wheel of a Ferris wheel turns more quickly than the axle.,true
A lever may or may not change the strength of the applied force.,true
The wheel of a wheel and axle turns more slowly than the axle.,false
A single fixed pulley has an ideal mechanical advantage of 1.,true
A compound pulley always contains at least two fixed pulleys.,false
A zip-line pulley is an example of a single moveable pulley.,true
simple machine that consists of a rope and grooved wheel,pulley
type of lever in which the fulcrum is between the input and output forces,class 1 lever
simple machine consisting of two connected rings or cylinders that both turn around a single center point,wheel and axle
simple machine that consists of an inclined plane wrapped around a cylinder or cone,screw
fixed point of a lever around which the bar rotates,fulcrum
simple machine consisting of a sloping surface that connects lower and higher elevations,inclined plane
type of lever in which input and output forces are on the same side of the fulcrum,class 2 lever
how greatly a machine increases the applied force,mechanical advantage
how well a machine deals with friction,efficiency
Compound machines include all of the following except a(n),chisel.
An axe is a compound machine that consists of a wedge and a(n),third class lever.
example of a third class lever,fishing rod
any machine that consists of more than one simple machine,compound machine
A compound machine tends to be less efficient than a simple machine because a compound machine,has more moving parts.
example of a wheel and axle that works as a pulley,fishing reel
Which of the following machines has the greatest mechanical advantage?,mountain bike
machine consisting of a wheel and axle and a lever,wheelbarrow
machine consisting of two levers and two wedges,scissors
A wheel and axle is an example of a compound machine.,false
A pulley system that contains a fixed and a moveable pulley is a compound machine.,true
A single pulley is less efficient than a pulley system that consists of two or more pulleys.,false
The mechanical advantage of a compound machine is generally less than that of a simple machine.,false
Friction tends to be a bigger problem in a compound machine than in a simple machine.,true
Which of the following is a compound machine?,scissors
The fulcrum in a pair of scissors is always located,between the input and output points.
The mechanical advantage of a compound machine equals the,product of the mechanical advantages of all its simple machines.
The way friction is reduced in a compound machine such as a car is with,lubricants.
Some compound machines consist of thousands of simple machines.,true
The output force is exerted by the handle ends of the levers in scissors.,false
